{
  "schema": "assay.event/1",
  "job": "admit",
  "idx": 1,
  "ts": "2026-10-11T06:16:00Z",
  "run_key": "run-42-1",
  "run_uid": {
    "repo_id": 840213377,
    "run_id": 18342009871,
    "run_attempt": 1
  },
  "stage": "S3",
  "kind": "SlotReaped",
  "data": {
    "run_uid": {
      "repo_id": 840213377,
      "run_id": 18341000002,
      "run_attempt": 1
    }
  }
}
